[
  {"topic_code":"relations","type":"fact","title":"The birth of the United Nations","body":"The UN Charter was signed in San Francisco on 26 June 1945 and came into force on 24 October 1945, now celebrated as United Nations Day. The UN replaced the League of Nations, created after World War I.","difficulty":1,"source_name":"Wikipedia: United Nations","source_url":"https://en.wikipedia.org/wiki/United_Nations"},
  {"topic_code":"relations","type":"fact","title":"The UN Security Council","body":"The Security Council has 15 members. Five are permanent and hold a veto: China, France, Russia, the United Kingdom and the United States. The other ten are elected for two-year terms.","difficulty":1,"source_name":"Wikipedia: United Nations Security Council","source_url":"https://en.wikipedia.org/wiki/United_Nations_Security_Council"},
  {"topic_code":"relations","type":"fact","title":"193 member states","body":"As of 2025, the United Nations has 193 member states. South Sudan, in 2011, was the most recent country to join. Two observer states, the Holy See and Palestine, are not full members.","difficulty":1,"source_name":"Wikipedia: Member states of the United Nations","source_url":"https://en.wikipedia.org/wiki/Member_states_of_the_United_Nations"},
  {"topic_code":"relations","type":"fact","title":"The African Union","body":"The African Union (AU) was launched in 2002 in Durban, South Africa, replacing the Organisation of African Unity. It has 55 member states and its headquarters are in Addis Ababa, Ethiopia.","difficulty":1,"source_name":"Wikipedia: African Union","source_url":"https://en.wikipedia.org/wiki/African_Union"},
  {"topic_code":"relations","type":"fact","title":"Africa Day","body":"The Organisation of African Unity (OAU) was founded on 25 May 1963 in Addis Ababa by 32 independent African states. 25 May is celebrated as Africa Day.","difficulty":1,"source_name":"Wikipedia: Organisation of African Unity","source_url":"https://en.wikipedia.org/wiki/Organisation_of_African_Unity"},
  {"topic_code":"relations","type":"fact","title":"SADC","body":"The Southern African Development Community (SADC) promotes economic integration, peace and security in southern Africa. It was established in 1992, succeeding a coordination conference formed in 1980. Its headquarters are in Gaborone, Botswana.","difficulty":1,"source_name":"Wikipedia: Southern African Development Community","source_url":"https://en.wikipedia.org/wiki/Southern_African_Development_Community"},
  {"topic_code":"relations","type":"fact","title":"ECOWAS","body":"The Economic Community of West African States (ECOWAS) was founded by the Treaty of Lagos on 28 May 1975 to promote economic integration in West Africa. Its headquarters are in Abuja, Nigeria.","difficulty":1,"source_name":"Wikipedia: ECOWAS","source_url":"https://en.wikipedia.org/wiki/ECOWAS"},
  {"topic_code":"relations","type":"fact","title":"The European Union","body":"The European Union is a political and economic union of European countries. As of 2025 it has 27 member states, after the United Kingdom left in 2020. Most members use the euro as their currency.","difficulty":1,"source_name":"Wikipedia: European Union","source_url":"https://en.wikipedia.org/wiki/European_Union"},
  {"topic_code":"relations","type":"fact","title":"NATO","body":"The North Atlantic Treaty Organization (NATO) is a military alliance founded in 1949. Under Article 5 of its treaty, an armed attack on one member is treated as an attack on all.","difficulty":1,"source_name":"Wikipedia: NATO","source_url":"https://en.wikipedia.org/wiki/NATO"},
  {"topic_code":"relations","type":"lesson","title":"Embassies and consulates","body":"An embassy is a country's main diplomatic mission in a foreign capital, led by an ambassador. Consulates are smaller offices, often in other cities, that help citizens abroad and issue visas.","difficulty":1,"source_name":"Wikipedia: Diplomatic mission","source_url":"https://en.wikipedia.org/wiki/Diplomatic_mission"},
  {"topic_code":"relations","type":"fact","title":"Diplomatic immunity","body":"The 1961 Vienna Convention on Diplomatic Relations sets the rules for diplomacy, including diplomatic immunity: diplomats cannot be prosecuted by the host country, though they can be expelled.","difficulty":2,"source_name":"Wikipedia: Vienna Convention on Diplomatic Relations","source_url":"https://en.wikipedia.org/wiki/Vienna_Convention_on_Diplomatic_Relations"},
  {"topic_code":"relations","type":"fact","title":"The Peace of Westphalia","body":"The Peace of Westphalia of 1648 ended the Thirty Years' War in Europe. It is often seen as the origin of the modern idea of sovereign states that do not interfere in each other's internal affairs.","difficulty":3,"source_name":"Wikipedia: Peace of Westphalia","source_url":"https://en.wikipedia.org/wiki/Peace_of_Westphalia"},
  {"topic_code":"relations","type":"fact","title":"Bretton Woods, 1944","body":"At the Bretton Woods conference in New Hampshire, USA, in July 1944, 44 Allied nations agreed a new international monetary system and created the International Monetary Fund and the World Bank.","difficulty":2,"source_name":"Wikipedia: Bretton Woods Conference","source_url":"https://en.wikipedia.org/wiki/Bretton_Woods_Conference"},
  {"topic_code":"relations","type":"fact","title":"The World Trade Organization","body":"The World Trade Organization (WTO) began on 1 January 1995, replacing the General Agreement on Tariffs and Trade (GATT) of 1947. It sets rules for trade between nations and settles trade disputes. It is based in Geneva.","difficulty":2,"source_name":"Wikipedia: World Trade Organization","source_url":"https://en.wikipedia.org/wiki/World_Trade_Organization"},
  {"topic_code":"relations","type":"fact","title":"BRICS","body":"BRICS began as a grouping of Brazil, Russia, India and China; South Africa joined in 2010. The group expanded from 2024 with new members including Egypt, Ethiopia, Iran and the United Arab Emirates.","difficulty":2,"source_name":"Wikipedia: BRICS","source_url":"https://en.wikipedia.org/wiki/BRICS"},
  {"topic_code":"relations","type":"fact","title":"The Non-Aligned Movement","body":"The Non-Aligned Movement was founded in Belgrade in 1961 by countries that chose not to formally join either side in the Cold War. Leaders of India, Egypt, Yugoslavia, Ghana and Indonesia played key roles.","difficulty":2,"source_name":"Wikipedia: Non-Aligned Movement","source_url":"https://en.wikipedia.org/wiki/Non-Aligned_Movement"},
  {"topic_code":"relations","type":"lesson","title":"Hard power and soft power","body":"Hard power is getting what you want through force or payment, like military action or sanctions. Soft power, a term coined by Joseph Nye, is attraction: culture, values and policies that make others want to cooperate.","difficulty":2,"source_name":"Wikipedia: Soft power","source_url":"https://en.wikipedia.org/wiki/Soft_power"},
  {"topic_code":"relations","type":"fact","title":"The Commonwealth","body":"The Commonwealth of Nations is a voluntary association of 56 member countries, as of 2025, most of them former British territories. Gabon and Togo, which have no historic ties to Britain, joined in 2022.","difficulty":2,"source_name":"Wikipedia: Commonwealth of Nations","source_url":"https://en.wikipedia.org/wiki/Commonwealth_of_Nations"},
  {"topic_code":"relations","type":"fact","title":"The International Court of Justice","body":"The International Court of Justice (ICJ), in The Hague, Netherlands, is the UN's main court. It settles legal disputes between states and gives advisory opinions. It has 15 judges elected for nine-year terms.","difficulty":2,"source_name":"Wikipedia: International Court of Justice","source_url":"https://en.wikipedia.org/wiki/International_Court_of_Justice"},
  {"topic_code":"relations","type":"fact","title":"The International Criminal Court","body":"The International Criminal Court (ICC), which began work in 2002 in The Hague, tries individuals for genocide, war crimes, crimes against humanity and aggression. Unlike the ICJ, it prosecutes people, not states.","difficulty":2,"source_name":"Wikipedia: International Criminal Court","source_url":"https://en.wikipedia.org/wiki/International_Criminal_Court"},
  {"topic_code":"relations","type":"lesson","title":"Economic sanctions","body":"Sanctions are penalties one or more countries place on another, such as trade bans, frozen assets or travel bans, to pressure a change in behaviour without using military force.","difficulty":1,"source_name":"Wikipedia: Economic sanctions","source_url":"https://en.wikipedia.org/wiki/Economic_sanctions"},
  {"topic_code":"relations","type":"fact","title":"The Geneva Conventions","body":"The four Geneva Conventions of 1949 set rules for the humane treatment of wounded soldiers, prisoners of war and civilians during armed conflict. Every UN member state has ratified them.","difficulty":2,"source_name":"Wikipedia: Geneva Conventions","source_url":"https://en.wikipedia.org/wiki/Geneva_Conventions"},
  {"topic_code":"relations","type":"fact","title":"The Paris Agreement","body":"Adopted in December 2015, the Paris Agreement on climate change aims to keep global warming well below 2 °C above pre-industrial levels, while pursuing efforts to limit it to 1.5 °C.","difficulty":1,"source_name":"Wikipedia: Paris Agreement","source_url":"https://en.wikipedia.org/wiki/Paris_Agreement"},
  {"topic_code":"relations","type":"lesson","title":"The UN General Assembly","body":"The General Assembly is the UN body where all 193 member states meet, each with one vote regardless of size. Its resolutions are mostly recommendations; binding decisions on peace and security come from the Security Council.","difficulty":1,"source_name":"Wikipedia: United Nations General Assembly","source_url":"https://en.wikipedia.org/wiki/United_Nations_General_Assembly"},